1003,26073.0,26073.0,Raglan,Nickel,5.0,05/2018,Underground,Open Pit,,"Nickel,Copper,Cobalt,Palladium,Platinum,Rhodium,Gold,Silver",Quebec,United States and Canada,61.684206,-73.676764,Exact,100 km ESE of Salluit,,,,1.0,1.0,1.0,1.0,,,,,,,,,,,1.0,Glencore plc (Owner) 100%,1.0,Native Title (NSR) 4.5%,,,,,,,,,,,,,1998.0,2.0,1998.0,3.0,,,,,3900.0,1300000.0,,,,,Cut & Fill Stoping,"Crushing, Flotation, Semi-Autogenous Grinding",Concentrate,,,473000.0,2002-02-01,,,Initial Capital Cost,"Falconbridge spent C$700 million, including all pre-development costs, to develop Raglan. Commercial production began in April 1998. (Falconbridge WS 2/02)",2002.0,Glencore plc,Glencore PLC,Glencore,,100.0,100.0,Baar,"Baar, Zug",Baar [CH],Zug,Switzerland,Europe,Raglan,"13-14, 2-3, 5-8, Cross Lake, Donaldson, INO, Katinniq, Kattiniq, Kikialik, Qakimajurq, Sudbury Operations, Zone 2, Zone 3",Canada,Active,Operating,2018.0,657800.0,2.2,69310.0,,1943360.0,29900000.0,"Staples et al., 2019Glencore AnnRpt 2019",6848289.466755903,3512554.2458048854,7727619.340770748,0.008969127093815553,9.490693983552157,4.0,0.0040960000000000015,Operating-stage
1009,27187.0,27187.0,Ramu,Nickel,2.0,02/2021,Open Pit,,,"Nickel,Cobalt,Chromite",Madang,Asia-Pacific,-5.57,145.195,Exact,75 km WSW of Madang,The Ramu property is located in the northern foothills of the Papua New Guinea Highlands in close proximity to the Rame River Valley. (NORD 1990 10K)    The property is located 763 m above sea level.  (NORD 1990 Prospectus),,,3.0,3.0,3.0,0.0,,,,,,,,,,,7.0,"Metallurgical Corporation of China Ltd. (Venturer) 56.97%; Jilin Jien Nickel Industry Co., Ltd. (Venturer) 11.05%; Jiuquan Iron and Steel (Group) Co., Ltd. (Venturer) 11.05%; Jinchuan Group International Resources Co. Ltd (Venturer) 5.93%; Mineral Resources Development Corp (Venturer) 3.94%; Local Interest (Venturer) 2.5%; Nickel 28 Capital Corp. (Carried) 8.56%",,,,,,,,,,,,,,,2012.0,4.0,2012.0,2.0,,,2061.0,,10300.0,3400000.0,,,,,Open Pit,High Pressure Acid Leach,"Concentrate, Hydroxide",,,2100000.0,1998-11-17,,,Initial Capital Cost,"In 2013, Highlands Pacific reported that Ramu cost $2.1 billion. (Highlands 12/31 AR)_x000D_
	As of April 2011, the total cost of the Ramu mine was $1.5 billion. (Highlands 3/11 QR 4/29/11)_x000D_
	As of April 2010, the Ramu project was fully funded at $1.4 billion. All major items were purchased, shipped to site, and in an advanced stage of installation and commissioning. Commissioning was expected to be completed during the September 2010 quarter. (Highlands 3/10 QR 4/28/10)_x000D_
	In June 2009, expended capital at Ramu totaled $1 billion. Procurement was 90% completed, with construction progressing well. The 135-km slurry pipeline was 75% complete, with all major river crossings finished. (Highlands PR 6/9/09)_x000D_
	In April 2008, the cost to develop Ramu was reported at $1.37 billion and was to be financed by approximately 70% debt and 30% equity. Financing from Chinese banking institutions would account for approximately 40% of the project cost, with a further 30% being provided by way of a shareholder loan from the Chinese syndicate involved in the project. The 30% equity would be funded by the Chinese syndicate (on behalf of all Joint Venture partners). The debt would be repaid over a 10-year period. _x000D_
	The 3.3 million-mt/y operation was projected to produce 31,150 mt/y of nickel and 3,300 mt/y of cobalt over 20 years. (Highlands Pacific 12/07 AR 4/18/08) _x000D_
Financing of the $1.37 billion development is as follows (approximately):_x000D_
• $344 million supplied by MCC and other MCC-JJJ shareholders as equity on behalf of all joint venture partners;_x000D_
• $560 million debt financing from the Export-Import Bank of China (China Eximbank); and_x000D_
• $473 million debt financing from MCC-JJJ Mining Development Company Limited as a shareholder loan._x000D_
(Highlands Pacific 7/23/08)_x000D_
	In November 2006, the cost of the Ramu project was stated at $800 million, 75% of which would be funded by the China Development Bank and the China Import and Export Bank. (ICM 11/10/06)_x000D_
	By October 2006, planned investment was $780 million. (Antaike Copper and Nickel Monthly 10/06)_x000D_
	In May 2005, capital costs were estimated at $750 million. (ICM 5/26/06)_x000D_
	In October, 2005, the total investment of the project was $673.35 million, with $101 million to be raised by China Metallurgical Construction Group, and  the remaining 85% to be arranged by MMC from bank loans. (Antaike 10/31/05)_x000D_
	In June 2004, development costs were estimated at $650 million. (ICM 6/21/04)_x000D_
  	In November 1998, based on a two-year feasibility study, the capital cost was estimated at $838 million, including approximately $200 million in infrastructure costs and $50 million in working capital and owner's costs. A post-feasibility engineering review suggested the potential to reduce the capital cost by up to 10%.    Nord and Highlands were investigating alternatives for financing the project. (Nord Pacific 11/17/98)",1998.0,Metallurgical Corporation of China Ltd.,Metallurgical Corp. of China Ltd.,MCC,Venturer,56.97,100.0,Beijing,Beijing,Beijing [CN],Beijing,China,Asia-Pacific,Ramu,"Basamuk, Danagari, EL 1178, EL 193, EL 2376, EL 2579, Greater Ramu, KBK, Kurumbukan, Kurumbukari, LMP 42, LMP 43, LMP 44, LMP 45, LMP 47, LMP 48, LMP 49, ME 75, ME 76, ME 77, ME 78, ME 79, ML 149, Ramu Nico, Ramu River, Ramu West, Raymu, Remy, Rui Ramu, Ruimu, SML 8",Papua New Guinea,Active,Operating,2021.0,504000.0,0.9,37698.0,136.0,1284000.0,56000000.0,Regency Mines PR 20120613Conic Metals Corp PR20200224,4212480.299143111,2041983.8278551586,3791232.2692288,0.00994346885733498,13.3694095177463,9.0,0.531441,Operating-stage
1033,34257.0,34257.0,Rio Tuba,Nickel,3.0,03/2019,Open Pit,,,"Nickel,Cobalt,Iron Ore,Limestone",Palawan,Asia-Pacific,8.59975,117.46561,Exact,190 km SW of Barangay San Miguel,,,,2.0,2.0,2.0,2.0,,,,,,,,,,,3.0,"Nickel Asia Corporation (Venturer) 60%; Pacific Metals Co., Ltd. (Venturer) 36%; Sojitz Corporation (Venturer) 4%",,,,,,,,,,,,,,,1975.0,,,,,,2026.0,,,,,,,,Open Pit,Crushing,"Hydroxide, Ore",,,,2002-07-29,,2005-05-15,Major Purchase,"In July 2002, Sumitomo entered into a joint venture to build a $175-million nickel-cobalt processing plant with Rio Tuba Nickel Mining, Mitsui, and another Japanese company. The plant was to be built next to the Rio Tuba mine. It will annually produce matte containing 10,000 mt nickel and 700 mt cobalt over a minimum project life of 20 years. (NM 7/29/02) As of June 2003, Sumitomo expected operations to start in 2005. (Sumitomo 3/03 AR 6/27/03)",2005.0,Nickel Asia Corporation,Nickel Asia Corporation,Nickel Asia Corp,Venturer,60.0,60.0,Taguig City,"Taguig City, Metro Manila",Taguig City [PH],Metro Manila,Philippines,Asia-Pacific,Rio Tuba,"CBNC II, Coral Bay, Guintalunan, Mangingidong, MPSA 114-98-IV, MPSA 213-2005-IVB, Sition Gotok, Umawi",Philippines,Active,Operating,2019.0,775000.0,1.28,67000.0,61.363,811500.0,60546875.0,"MGB, 2018",6302933.887958184,3033931.937598719,8067755.376586475,0.008304664292926067,11.567164179104477,8.0,0.2621440000000001,Operating-stage
1035,26724.0,26724.0,Riverina,Nickel,9.0,09/2019,Open Pit,Underground,,"Nickel,Cobalt,Gold",Western Australia,Asia-Pacific,-29.745,120.56389,Exact,140 km NW of Kalgoorlie,The Riverina project is centred 125 km north of Coolgardie. (Barra 6/14 QR 7/27/14),,,1.0,1.0,1.0,1.0,,,,,,,,,,,2.0,Riverina Resources Pty Ltd (Venturer) 70%; Greenstone Resources Limited (Venturer) 30%,,,,,,,,,,,,,,,,,,,,,,,,,,,,,Open Pit,Heap Leach,,,,4400.0,1990-12-31,,,Initial Capital Cost,THESE FUNDS ARE NEEDED TO ACCESS THE UNDERGROUND LEVELS WHERE THE ESTIMATED RESERVES LIE.  (RAM 90/91),1990.0,Riverina Resources Pty Ltd,Riverina Resources Pty. Ltd.,Riverina Rsrc Pty,Venturer,70.0,70.0,,,,,,,Riverina,"E30/333, M30/127, M30/133, M30/182, M30/256, Martins Zone, Martin's Zone, P30/1074, P30/1112, P30/1113, P30/1114, P30/1115, P30/1116, P30/1117, P30/1118, P30/1119, P30/1120, Reggies Line, Riverina, Riverina East",Australia,Inactive,Reserves Development,2019.0,,1.01,,2.2,,,,,,,,,4.0,0.0040960000000000015,Development-stage
1058,28354.0,28354.0,Samapleu,Nickel,9.0,09/2021,Open Pit,,,"Nickel,Copper,Cobalt,Platinum,Palladium,Gold,Iron Ore",Dix-Huit Montagnes,Africa,7.76179,-7.90051,Exact,55 km NW of Man,Samapleu is located 600 km northwest of Abidjan and 50 km west of Biankouma in Cote d'Ivoire. (Landen PR 12/21/09),,,2.0,2.0,2.0,1.0,,,,,,,,,,,3.0,Cote D'ivoire (Owner) 40%; Sama Resources Inc. (Optionor) 24%; I-Pulse Inc. (Optionee) 20.7%,1.0,Local Interest (NSR) 1%,,,,,,,,,,,,,,,,,,,,,7300.0,2400000.0,,,1.17,,Open Pit,"Ball, Calcination, Crushing, Flotation, Roasting, Semi-Autogenous Grinding",Concentrate,21.24,,282000.0,2020-05-27,,,Initial Capital Cost,"In May 2020, Sama reported results of its PEA at Samapleu which estimated a capital cost of $282 million including contingency of $37 million. (Sama PR May 27, 2020)",2020.0,Cote D'ivoire,Cote D'ivoire,Cote Divoire,,40.0,40.0,,,,,Cote d'Ivoire,Africa,Samapleu,"Bounta, Gangbapleu, Grata, Kouroba, PR 123, PR 300, PR 301, Samapleu Extension 1, Sipilou South, SM Extension 1, Yepleu, Zeregouine, Zoupleu",Cote d'Ivoire,Active,Prefeas/Scoping,2021.0,,0.233,,40.639,95670.0,,"Ouattara et al., 2009",,,,,,7.0,0.11764899999999996,Late-stage exploration
1062,29226.0,29226.0,San Felipe,Nickel,7.0,07/2007,Open Pit,,,"Nickel,Cobalt,Copper,Gold",Camagüey,Latin America and Caribbean,21.54611,-77.96778,Exact,20 km NNW of Camagüey; 487.5 km ESE of Havana,,,,2.0,3.0,1.0,0.0,,,,,,,,,,,1.0,Cubaniquel (Owner) 100%,,,,,,,,,,,,,,,,,2016.0,,,,,,,,,,,,Open Pit,"Pressure Acid Leaching, Solvent-Extraction Electrowinning",,,,300000.0,1995-04-25,,,Initial Capital Cost,"In early 1995, the facility was projected to cost $300 million.  (AMM 4/25/95)",1995.0,Cubaniquel,Cubaniquel,Cubaniquel,,100.0,100.0,Havana,Havana,Havana [CU],,Cuba,Latin America and Caribbean,San Felipe,,Cuba,Active,Reserves Development,2007.0,,1.3,,250.0,,,BHP 2002 San Felipe Concept Study,,,,,,6.0,0.04665599999999999,Development-stage
1070,33832.0,33832.0,Santa Rita,Nickel,6.0,06/2016,Open Pit,Underground,,"Nickel,Copper,Cobalt,Platinum,Palladium,Gold",Bahia,Latin America and Caribbean,-14.18902,-39.71144,Exact,185 km SW of Salvador,,,,2.0,2.0,2.0,1.0,,,,,,,,,,,1.0,Appian Capital Advisory LLP (Owner) 100%,2.0,Local Interest (Royalty) 1%; Companhia Baiana De Pesquisa Mineral (Royalty),,,,,,,,,,,,,2009.0,4.0,2010.0,3.0,,,2040.0,,21800.0,7200000.0,,,,8.5,"Open Pit, Underground","Ball, Crushing, Flotation, Semi-Autogenous Grinding",Concentrate,,,462100.0,2009-07-28,,2010-09-08,Initial Capital Cost,"In July 2009, Mirabela reported that costs overruns at Santa Rita were approximately $28.1 million; representing a cost overrun of approximately 6% of the initial capital cost estimate for the project of $434 million. (Mirabela PR 7/28/09)_x000D_
	In fiscal 2009, Mirabela secured a total of $290 million in debt and $233 million equity to fund development of Santa Rita. (Mirabela 6/09 AR 10/29/09)_x000D_
	In November 2008, capital costs for Santa Rita were reported to be $387 million.  The total included the plant, infrastructure, land, port, first fill, spares, and contingency. (Mirabela PR 11/27/08)_x000D_
	In October 2008, the capital cost was reduced by $40 million due to reduced exploration work. As a result, the debt facility required was reduced from $280 million to $240 million of which $80 million was already drawn-down. (Mirabela PR 10/29/08) _x000D_
	In July 2008, the estimated sunk capital cost of the revised 6.4 million-mt/y project was $387 million, including plant, infrastructure, land acquisition, port upgrade, first fills, spares and contingency. The new capital cost estimate represented a 20% increase over the previous estimate of $322 million for the 4.6 million-mt/y project. (Mirabela PR 7/29/08)_x000D_
	In July 2008, Mirabela entered into an $80 million bridge financing facility to fund ongoing construction at Santa Rita and an underwritten $280 million loan facility.  (Mirabela PR 7/10/08) _x000D_
	In January 2008, Mirabela mandated BNP Paribas and Credit Suisse to act as lead arrangers of a debt financing facility of up to $260 million for the development of Santa Rita. (Mirabela PR 1/10/08) Capital costs for the 4.6 million-mt/y operation were increased to $322 million, including $267 million for the plant and infrastructure, $16 million for a 50,000-m drill program, $10 million for additional land rights, $5 million for geotechnical drilling, and $24 million in contingency. (Mirabela PR 1/23/08)_x000D_
   In July 2007, capital costs were estimated at $263 million.  Equity funding of $160 was already complete and debt financing was to be used to fund the rest. (Mirabela PR 6/5/07)_x000D_
   In January 2007, the estimated capital costs for Santa Rita amounted to $215 million, based on 4 million-mt/y flotation plant. Mirabela had envisioned the capital would be comprised of $100 million from equity, and $115 million funded through debt. (Mirabela Corporate Presentation 1/5/06)_x000D_
   By October 2006, capital costs for Santa Rita had been estimated at $150-180 million (based on a 4 million-mt/y flotation plant), including working capital. Funding for the project was expected to be structured as follows: $60-90 million through equity, and $90 million through debt. (Mirabela Presentation 10/3/06)",2010.0,Appian Capital Advisory LLP,Appian Capital Advisory LLP,Appian Cap,,100.0,100.0,London,"London, England",London [GB],England,United Kingdom,Europe,Santa Rita,"Grutinha Salobo, Palestina, Peri Peri, Sao Francisco, Sao Pedro, Southern Zone Deeps",Brazil,Active,Operating,2016.0,881000.0,0.31,1723.0,226.88,1172723.0,184600000.0,"Anglo American AnnRpt 2019 (Reserves and Resources)Atlantic Nickel Ltd website (accessed June 2020); Ingwood et al;, 2011",3150543.29770728,1371753.0599638752,976668.4222892568,0.001764160651330759,511.3174695298897,7.0,0.11764899999999996,Operating-stage
1077,27713.0,27713.0,Savannah,Nickel,10.0,10/2021,Underground,Open Pit,,"Nickel,Copper,Cobalt,Vanadium,Titanium,Iron Ore,Graphite",Western Australia,Asia-Pacific,-17.35093,128.02609,Exact,190 km SSW of Kununurra,Sally Mally is about 250 km south of the port of Wyndham. (PC 11/92),,East Kimberley,1.0,1.0,1.0,1.0,,,,,,,,,,,2.0,Panoramic Resources Limited (Owner) 100%; Ora Gold Limited (Fractional),1.0,Local Interest (NSR),,,,,,,,,,,,,2004.0,1.0,2004.0,1.0,,,2033.0,,,,,,,,Long Hole Stoping,"Crushing, Flotation, Semi-Autogenous Grinding",Concentrate,,,46426.25,2002-08-28,2004-06-15,2004-08-18,Initial Capital Cost,"In August 2003, Sally Malay Mining issued 6.9 million ordinary shares at A$0.29/share to raise A$2 million. These funds represented the balance of the equity required by the project financiers as a condition for the drawdown of the Sally Malay senior financing facility. At the same time, development work had started at Sally Malay, with the awarding of contracts for the construction of the 120-person village and the plant and village access roads. (Sally Malay PR 8/1/03)_x000D_
	In July 2003, Sally Malay estimated a capital cost of about $A60 million, which included about A$48 million for the plant, infrastructure, and insurance, and about A$12 million for the open-pit mining pre-strip. (Sally Malay PR 7/14/03)_x000D_
	In July 2003, Sally Malay Mining secured A$46 million ($31 million) in financing from the MacQuarrie Bank and the Standard Bank of London for mine development at Sally Malay. (AMM 7/8/03)_x000D_
	In July 2003, Sally Malay Mining signed a life-of-mine concentrate sales contract with Sino Nickel (Jinchuan Group 60%, Sino Mining 40%). Jinchuan also provided Sally Malay with $5 million in project financing. (Sally Malay PR 7/22/03)_x000D_
	In early March 2003, Sally Malay Mining announced that it had accepted the offer of a A$52 million ($29.1 million) loan facility from Macquarie Bank and Standard Bank London to develop Sally Malay. (Sally Malay Mining 3/13/03)_x000D_
	In late January 2003, Sally Malay Mining completed a A$1.7 million share placement with DJ Carmichael & Co. A total of A$6.7 million ($3.7 million) was raised through placements to date would be used to fund development at Sally Malay. The company did not expect to require further equity raising related to Sally Malay. (Sally Malay PR 1/29/03)_x000D_
	Based on a feasibility delivered in August 2002, capital costs were estimated at A$54.3 million. This cost included: direct costs related to plant and associated infrastructure - A$37.2 million; indirect costs including EPCM, temporary facilities, and contingency - A$11.4 million; and other costs including 1st fill and capital spares, insurance, and owner's costs - A$5.7 million. (Sally Malay PR 8/20/02)_x000D_
	In July 2002, Sally Malay Mining, Jinchuan Group Ltd, and Sino Mining International Ltd signed a life-of-mine concentrate sales agreement, a project financing agreement, and an intermediate product feasibility study financing agreement for Sally Malay. Jinchuan agreed to purchase 100% of annual Sally Malay concentrate production on a life-of-mine basis. The offtake agreement would represent revenue to Sally Malay of approximately A$420 million over the initial project life of 5.5 years, based on a nickel price of $3.25/lb and an exchange rate of $/A$0.58._x000D_
	Jinchuan and Sino agreed to provide a $5 million project debt facility._x000D_
	In addition, Jinchuan and Sino were also considering financing 100% of the cost of a bankable feasibility study into the production of an added value nickel/cobalt intermediate product at Sally Malay from low grade flotation concentrate. The aim was to select an appropriate technology that could increase the metallurgical recoveries to +95% and provide a product (mixed sulphide or carbonate) that could be refined directly, thereby increasing the overall payability of the contained metals. (Sally Malay PR 7/29/02)",2004.0,Panoramic Resources Limited,Panoramic Resources Ltd.,Panoramic Rsrc Ltd,,100.0,100.0,Perth,"Perth, Western Australia",Perth [AU],Western Australia,Australia,Asia-Pacific,Savannah,"Copernicus, Dave Hill, E80/4834, E80/4880, E80/5131, E80/5238, East Kimberley, Frog Hollow, Keller Creek, L80/64, M80/179, M80/180, M80/181, M80/182, M80/183, Mable Downs, ML80/180, Northern Ore Zone, Norton, Oxide, Sally Malay, Sally Malay Deeps, Savannah North, SNM, Stoney Creek, Sub-Chamber D, Three Nuns, Upper zone, Wilsons",Australia,Active,Operating,2021.0,101770.2,1.23,3417.0,13.456,209800.0,8021000.0,Norilsk Nickel Resource Statement 2018Panoramic Resources Q1-4 2019,1627896.5503018082,939934.4647679882,1156119.3916646254,0.0029555771009774964,29.783494293239684,4.0,0.0040960000000000015,Operating-stage
1084,27053.0,27053.0,Selebi-Phikwe,Nickel,8.0,08/2021,Underground,,,"Nickel,Copper,Cobalt",Central,Africa,-21.94892,27.85471,Exact,95 km SSE of Francistown,,,,1.0,2.0,1.0,0.0,,,,,,,,,,,2.0,Bamangwato Concessions Ltd. (Owner) 100%; Global Initiatives (Fractional),,,,,,,,,,,,,,,1990.0,3.0,,,,,2012.0,,1500.0,495000.0,,,,,"Cut & Fill Stoping, Open Stope, Underground","Crushing, Flotation, Grinding","Concentrate, Matte",,,140000.0,2010-08-13,,,New Zone Development,"In August 2010, BCL and Global Initiatives were planning to build a plant at Selebi-Phikwe to re-treat 100 million mt of tailings and 45 million mt of smelter slag. Capital costs were estimated at $140 million. (Bamangwato PR 8/13/10)",2010.0,Bamangwato Concessions Ltd.,Bamangwato Concessions Ltd.,Bamangwato,,100.0,100.0,Selibe Phikwe,"Selibe Phikwe, Central",Selibe Phikwe [BW],Central,Botswana,Africa,Selebi-Phikwe,"BCL, Mt Selibe North, Phikwe, Selibe-Phikwe",Botswana,Active,Operating,2021.0,159250.0,0.325,28940.0,,,49000000.0,,1394710.1734297276,684254.4956403454,222382.71108311226,0.13013601578579598,5.5027643400138215,4.0,0.0040960000000000015,Operating-stage
1086,27655.0,27655.0,Selkirk,Nickel,5.0,05/2015,Open Pit,Underground,,"Nickel,Copper,Cobalt,Platinum,Palladium",North-East,Africa,-21.31417,27.72861,Exact,25 km SE of Francistown,Selkirk is located in the north-eastern corner of Botswana. Selkirk is located in a water deficit region in which evaporation and evaporative transpiration exceeds rainfall. The area is north of the Tropic of Capricorn. (Lionore PR 3/5/07),,,1.0,2.0,1.0,0.0,,,,,,,,,,,2.0,Public Joint Stock Company Mining and Metallurgical Company Norilsk Nickel (Venturer) 85%; Government of Botswana (Venturer) 15%,,,,,,,,,,,,,,,2005.0,1.0,2010.0,,2002.0,3.0,2024.0,,,,,,0.54,,Open Pit,"Crushing, Dense Media Separation, Grinding, Hydrometallurgical, In-Situ Leach, Oxidation, Solvent-Extraction Electrowinning",Concentrate,,,160000.0,2007-02-02,,,Initial Capital Cost,"In February 2007, Selkirk's initial capex was estimated at $160 million. (LionOre PR 2/2/07)",2007.0,Public Joint Stock Company Mining and Metallurgical Company Norilsk Nickel,Public Joint Stock Company Mining and Metallurgical Company Norilsk Nickel,Nornickel,Venturer,85.0,100.0,Moscow,"Moscow, Moskva",Moscow [RU],Moskva,Russia,Europe,Selkirk,"Tati, Tati Nickel",Botswana,Active,Feasibility,2015.0,,0.23,,135.3,315200.0,,,,,,,,4.0,0.0040960000000000015,Feasibility-stage
1102,31518.0,31518.0,Shakespeare,Nickel,6.0,06/2021,Open Pit,Underground,,"Nickel,Copper,Palladium,Platinum,Gold,Cobalt,Silver",Ontario,United States and Canada,46.33417,-81.85944,Exact,20 km NE of Massey,"The property is located north of Agnew Lake, near the village of Webbwood, Ontario. (Wellgreen PROS 5/12/14)_x000D_
The Shakespeare property is located 10 km northeast of Ursa'a Porter Township platinum group metals property.  (MJ 6/16/00)",,Sudbury,1.0,1.0,1.0,1.0,0.186,,,,,38.0,3800.0,,,,1.0,Magna Mining Inc. (Owner) 100%,2.0,Glencore plc (NSR) 1.5%; Nickel Creek Platinum Corp. (NSR) 1%,,,,,,,,,,,,,2010.0,3.0,,,,,2012.0,,4500.0,1485000.0,,,5.15,,"Open Pit, Underground","Crushing, Flotation, Grinding",Concentrate,23.98,,133400.0,2004-11-01,,,Initial Capital Cost,"In February 2010, URSA arranged a $2.5 million credit facility with Auramet Trading to assist in resuming production at Shakespeare. Also, a definitive milling and smelting agreement was executed with Xstrata for the processing of Shakespeare ore. (URSA PR 2/17/10) _x000D_
In April 2008, URSA announced an update on the feasibility study at Shakespeare.  The project would have a production life of 7.2 years and increased capital costs $133.4 million (C$148.2 million).  (URSA PR 4/23/08)_x000D_
In January 2006, URSA announced that Micon had completed a positive feasibility study on Shakespeare. The study envisioned a base case scenario involving a $101.9 million (C$118.5 million), 6.8-year open pit operation including an on-site concentrator capable of processing 4,500 mt/d of ore. The estimated capital cost included $16.3 million (C$18.9 million) for mining equipment, $9.3 million (C$10.8 million) for pre-stripping, $41.8 million (C$48.6 million) in process plant costs, $15.9 million (C$18.5 million) in site infrastructure costs, tailings dams, and a high compression thickener, and $18.7 million (C$21.7 million) in owners costs, EPCM, and contingency. (URSA PR 1/20/06)  _x000D_
In November 2004, Ursa Major completed a prefeasibility study at Shakespeare based on a $11.57 million (C$15.04 million), 2,900-mt/d operation with truck haulage to mill. (Ursa Major PR 11/1/04)",2004.0,Magna Mining Inc.,Magna Mining Inc.,Magna Mining Inc,,100.0,100.0,Sudbury,"Sudbury, Ontario",Sudbury [CA],Ontario,Canada,United States and Canada,Shakespeare,"Baldwin, Shakespeare East, Shakespeare West, Springer Showing, Strathcona mill",Canada,Active,Reserves Development,2021.0,,0.33,,11.83,39000.0,,,,,,,,4.0,0.0040960000000000015,Development-stage
1105,28363.0,28363.0,Shangani,Nickel,7.0,07/2016,Underground,,,"Nickel,Cobalt,Copper",Midlands,Africa,-19.68823,29.22665,Exact,85 km NE of Bulawayo,,,Bindura,3.0,3.0,2.0,0.0,,,,,,,,,,,1.0,Bindura Nickel Corporation Limited (Owner) 100%,,,,,,,,,,,,,,,2007.0,2.0,1970.0,,2008.0,,,,1820.0,600000.0,,,,,Underground,,Concentrate,,,,2010-04-16,,,Reopening,"As of April 2010, Mwana was looking to restart operations at the Trojan mine in six to seven months, before restarting the rest of the complex. The Trojan mine would cost $50 million to restart, while the entire Bindura complex would cost $150 million. (Reuters 4/16/10)",2010.0,Bindura Nickel Corporation Limited,Bindura Nickel Corp. Ltd.,Bindura Nickel,,100.0,100.0,Bindura,"Bindura, Mashonaland Central",Bindura [ZW],Mashonaland Central,Zimbabwe,Africa,Shangani,"Bindura, Insiza, Shanghai",Zimbabwe,Active,Operating,2016.0,134833.0,0.78,960.0,12.03,68000.0,17286282.05128205,USGS/BM YB,1700488.8755119673,916287.9800561932,714704.6244438307,0.0013432122406470412,140.45104166666667,8.0,0.2621440000000001,Operating-stage
