759,30481.0,30481.0,Mindoro,Nickel,5.0,05/2020,Open Pit,,,"Nickel,Cobalt,Chromite,Iron Ore",Mindoro Occidental,Asia-Pacific,13.05333,121.13833,Exact,Located in Sablay,,,,2.0,2.0,2.0,2.0,,,,,,,,,,,1.0,Unnamed Owner (Owner) 100%,,,,,,,,,,,,,,,,,2003.0,,,,,,,,,,,,Open Pit,"Gravity, High Pressure Acid Leach, Leach, Precipitation, Semi-Autogenous Grinding, Solvent Extraction","Briquettes, Concentrate",,,2455000.0,1998-08-30,,,Initial Capital Cost,"As of year ended December 2014, the stage 1 scoping study capital cost was estimated at $980 million, with production at 18,000 mt/y Ni. Stage 1 could provide early cash flow for the following stages 2 and 3. (Intex 12/14 AR Apr 22, 2015)_x000D_
    By November 2011, Intex Resources completed a scoping study stage start up of Mindoro, beginning with production of up to 20,000 mt/y Ni. Capital costs were estimated at $800 million, full production of 52,700 mt/y Ni would be obtained over three stages. The plan included a conventional open-pit mine producing 6 mt/y of ore, to be transported 43 km by conveyor to the coast, where a processing plant would be located near Pola. (MJ 11/4/11)_x000D_
  	In February 2010, it was reported that an independent feasibility study for development of Intex's Mindoro lateritic nickel-cobalt project had found that an operation capable of producing 52,700 mt/y of nickel would cost about $2.46 billion. the cost included a $339 million contingency, and based on mining equipment, conveyor, processing plants, refinery, wharf and related infrastructure.  The study, by consultant Aker Solutions, included saprolite mineralization as well as limonite, representing a change to original plans to treat only limonite. The plan included an open pit mine producing 6 million mt/y of ore, to be transported 43 km by conveyor to the coast, where a processing plant would be located near Pola. (MJ 2/26/10)_x000D_
	In August 2008, it was reported that Intex planned a number of changes to the first stage of development, leading to slightly higher capital costs, but lower cash operating costs. A revised prefeasibility study outlined capital costs estimated at $2.2 billion for a high-pressure acid leaching operation, compared with the previous estimate of $2 billion. The project's forecast output remained at 40,000 mt/y of nickel and 3,000 mt/y of cobalt in mixed-sulphide product (MSP), using two autoclaves processing about 4.8 million mt/y of limonite._x000D_
	Intex planned to develop a second stage of operations at Mindoro to exploit saprolite mineralization, forecast to double output to 80,000 mt/y nickel-in-MSP, plus an additional 700 mt/y of cobalt, and to reduce cash operating costs to $2.00/lb. Capital costs for stage two were estimated at an additional $960 million, for overall estimated capital costs at Mindoro of $3.2 billion (previously $2.9 billion), including a contingency of $526 million. (MJ 8/22/08)_x000D_
	In late February 2008, a scoping study, which considered Intex's Stage-2 expansion plans for the Mindoro HPAL processing facility to incorporate saprolite processing circuits, was completed by Aker Kvaerner. _x000D_
	The scoping study was based on input of 4.8 million mt/y of limonite ore and a similar amount of saprolite ore. The limonite ore had 0.89% Ni and the saprolite ore was 1.18% Ni. The plant production for stage-1 was projected at 70,620 mt/y mixed sulphide containing 39,400 mt/y Ni and 3,020 mt/y Co. The combined stage-1 and -2 would produce 137,100 mt/y mixed sulphide containing 80,000 mt/y Ni and 3,740 mt/y Co._x000D_
	The estimated capital cost for stage-2 was $960 million, composed of $300 million for the expanded process plant and $260 million for additional process packages.  (Index PR 2/25/08) The prefeasibility study for the first stage estimated capital costs at $2 billion, giving a combined capital cost for both stages of $2.9 billion. (MJ 2/29/08) _x000D_
	In February 2008, estimated capital costs for the first stage development of the project had risen to $2 billion from $1.4 billion forecast last year, but Intex noted planned output had risen slightly from 37,000 mt/y Ni to 40,000 mt/y Ni. _x000D_
	The first stage was designed as a 7 million-mt/y open pit mine. The processing plant would use two autoclaves to process limonite mineralization to produce 40,000 mt/y Ni and 3,000 mt/y Co in a mixed sulphide product (at about 55% Ni). Nickel recovery was estimated at more than 94%. (MJ 2/1/08)_x000D_
 	In June 2007, stage two of development was expected to cost $300 million. (MJ 6/8/07) _x000D_
 	In its November 2006 Oslo IPO prospectus, Crew Minerals reported that the first stage of the Mindoro nickel project development, which could begin as early as 2009, was expected to require $400 million. The full development of the project was expected to require funding of a further $1 billion. (Crew Prospectus 11/30/06) _x000D_
	In August 1998, capital costs were estimated at $665 million for a 40,000-mt/y Ni operation, increasing to $935 million for 80,000 mt/y.  They included a harbor, a power station, a 30-km pipeline, and a small community.  (NM 8/30/98)",1998.0,Unnamed Owner,Unnamed Owner,Unnamed Owner,,100.0,100.0,,,,,USA,United States and Canada,Mindoro,"Alag-Ag, Buraboy, Kapawa, Lower Kisluyan, Mindoro Nickel Project, MNP, Pagong, Sablayan, Shabo, Upper Kisluyan",Philippines,Active,Feasibility Complete,2020.0,1199000.0,0.95,,344.7,2926000.0,126300000.0,,7544126.098630832,3398865.4707108005,7166919.79369929,,,8.0,0.2621440000000001,Development-stage
778,27315.0,27315.0,Montcalm,Nickel,12.0,12/2015,Underground,,,"Nickel,Copper,Cobalt",Ontario,United States and Canada,48.66432,-82.094,Exact,60 km WNW of Timmins,,,Porcupine,1.0,1.0,1.0,1.0,,,,,,,,,,,,,1.0,,,,,,,,,,,,,,2004.0,4.0,2005.0,1.0,2009.0,2.0,,,2270.0,750000.0,,,,,,,,,,71000.0,2003-10-31,,2004-12-31,Initial Capital Cost,"In October 2003, Falconbridge received the permits to develop the Montcalm project. Capital costs for the 8,000 mt/y mine, slated for completion by early 2005, was estimated at about C$100 million ($71 million). Ore from the mine will be sent to the concentrator at the Kidd Creek operations in Timmins and the concentrate will subsequently be shipped to the nickel smelter in Sudbury. (Falconbridge PR 10/31/03)",2004.0,,,,,,,,,,,,,Montcalm,,Canada,Inactive,Closed,2015.0,20370.0,0.7275,,,,2800000.0,,485801.52504109166,308365.64608498395,224336.00752682582,,,4.0,0.0040960000000000015,Closed-stage
782,37604.0,37604.0,Montes Claros,Nickel,1.0,01/2016,Open Pit,,,"Nickel,Cobalt",Goiás,Latin America and Caribbean,-16.00644,-51.39837,Approximate,Located in Montes Claros de Goiás,,,,2.0,2.0,2.0,1.0,,,,,,,,,,,,,,,,,,,,,,,,,,,,,2012.0,,,,,,,,,,,,Open Pit,,,,,311900.0,2010-05-11,,,Initial Capital Cost,"As of May 2010, the Montes Claros project was held 100% by Votorantim Metais. (DC 5/10) As currently planned, the mine will begin production of 23,000 mt/y Ni in 2012 at a total cost of $311.9 million (BRL 558 million). (ESTEIO WS 5/10)",2010.0,,,,,,,,,,,,,Montes Claros,,Brazil,Inactive,Preproduction,2016.0,4320000.0,1.295,,,,333590733.5907336,0.27https://www.globenewswire.com/news-release/2018/04/26/1488327/0/en/Brazil-Minerals-Inc-Adds-Cobalt-Nickel-and-Copper-Areas.html,19334458.360544875,7981675.9170776205,25038123.576905612,,,7.0,0.11764899999999996,Construction-stage
791,32689.0,32689.0,Morro Sem Bone,Nickel,12.0,12/2012,,,,Nickel,Mato Grosso,Latin America and Caribbean,-13.19779,-60.29933,Exact,75 km NW of Comodoro,,,,2.0,2.0,2.0,1.0,,,,,,,,,,,,,,,,,,,,,,,,,,,,,2015.0,,,,,,,,,,,,,,,,,1670000.0,2009-04-13,,,Initial Capital Cost,"In February 2009, Anglo American had reportedly postponed prefeasibility work at Morro Sem Bone by one year. (BNA 3/2/09) As planned, the project would cost $1.67 billion to begin production in 2016 at a rate of 32,000 mt/y Ni. (Anglo American 12/08 AR 2/20/09)",2009.0,,,,,,,,,,,,,Morro Sem Bone,,Brazil,Inactive,Reserves Development,2012.0,,1.76,,47.0,,,,,,,,,7.0,0.11764899999999996,Development-stage
820,27453.0,27453.0,Munali,Nickel,10.0,10/2018,Underground,,,"Nickel,Copper,Cobalt,Platinum,Palladium",Southern,Africa,-15.92333,28.13444,Exact,60 km S of Lusaka,,,,2.0,2.0,1.0,0.0,,,,,,,,,,,2.0,Consolidated Mining and Investments Ltd (Optionee) 68%; Jinchuan Group International Resources Co. Ltd (Optionor) 32%,1.0,Jinchuan Group International Resources Co. Ltd (Royalty),,,,,,,,,,,,,2010.0,1.0,2008.0,2.0,2013.0,4.0,2018.0,2.0,3640.0,1200000.0,,,,,,"Crushing, Flotation",Concentrate,,,124000.0,2006-08-17,,,Initial Capital Cost,"The mine cost around $124 million to build, targeting nameplate capacity of 75,000 mt/month at the mine to bring production up to 900,000 mt/y.  This would produce around 8,500 mt/y of nickel in concentrate._x000D_
	Following this, Albidon was eyeing an expanded target of 1.2 million mt/y, with the ore to come from the Enterprise deposit, that would produce more than 10,000 mt/y nickel in a nickel-copper-cobalt-platinum group metals concentrate. The expansion was scheduled for early 2009. (MiningNews.net 11/19/08)_x000D_
	By November 2007, the project capital cost had increased to $124 million since the bankable feasibility study 2006. Much of this increase was due to industry-wide cost pressures on equipment, fuel and labour. The securing of a back-up power supply added about $3.5 million of these additional capital requirements. (Mineweb 11/28/07)_x000D_
	In October 2007, Albidon increased the estimated capital costs of Munali to $100 million. (Albidon Presentation 10/2/07)_x000D_
	In late May 2007, The European Investment Bank and Barclays Capital provided a senior debt financing facility of up to $60 million for the Munali project. As part of the requirements associated with this facility, Albidon  completed a nickel hedging program over the debt service period between June 2009 and December 2013.  Albidon forward hedged 9,020 mt (164 mt/m), which represented less than 15% of the project's expected payable Ni production, and no more than 26% of payable Ni from production in any one year. The hedging was to begin in June 2009 which would allow for full production ramp up from mid-2008 and provides exposure to the spot price of Ni for the first 12 months of production. (Albidon PR 5/31/07)_x000D_
	In December 2006, capital costs were estimated at $80 million, including $51 million for the concentrator, $14 million for surface infrastructure, $5 million for mine infrastructure, $9 million for contingencies and $1 million miscellaneous. (Albidon 12/06 AR 5/3/07) _x000D_
	In April 2007, Albidon announced that the European Investment Bank and Barclays Capital officially approved the $60 million facility for Munali announced in January 2007. (Albidon PR 4/30/07)_x000D_
	Also in April, Albidon completed a $5 million share placement to Jinchuan Group pursuant the December 2006 offtake agreement between the companies. The funds would be used for equipment purchases, construction, and mine development at Munali. (Albidon PR 4/12/07) _x000D_
	By mid-month, all facets of the agreement had been executed, thus completing the offtake contract and offtake financing arrangements for the project. (Albidon PR 4/17/07) _x000D_
	In December 2006, after protracted negotations with several major nickel companies, Albidon signed offtake and financing agreements with China's Jinchuan Group. Under the agreements, Jinchuan would purchase all nickel concentrate derived from the Munali project and any expansions thereof, provide a $20 million subordinated debt financing facility for the project's development, and subscribe for $5 million in Albidon shares. _x000D_
	In August 2006, captial costs were estimated at $65 million, which included $36 million for the concentrator and $14 million for surface infrastructure. _x000D_
	Albidon planned to fund the development of Munali by a combination of debt and equity financing. (Albidon PR 8/17/06)",2006.0,Consolidated Mining and Investments Ltd,Consolidated Mining and Investments Ltd,Consolidated Minin,Optionee,68.0,68.0,London,"London, England",London [GB],England,United Kingdom,Europe,Munali,"Enterprise, Lusaka, Munami, Voyager",Zambia,Active,Operating,2018.0,60160.0,1.0,4714.0,6.01,60160.0,6010000.0,Consolidated Nickel Mines Munali Factsheet April 2020Consolidated Nickel Mines Munali Factsheet April 2020 and website (accessed May 2020),1097088.2471603986,650121.0049129025,650121.0049129025,0.007250957843811769,12.761985574883326,5.0,0.015625,Operating-stage
823,28725.0,28725.0,Murrin Murrin,Nickel,4.0,04/2019,Open Pit,,,"Nickel,Cobalt",Western Australia,Asia-Pacific,-28.76913,121.89354,Exact,55 km WSW of Laverton,,,,1.0,1.0,1.0,1.0,,,,,,,,,,,1.0,Glencore plc (Owner) 100%,1.0,GME Resources Limited (PTR),,,,,,,,,,,,,1999.0,2.0,1998.0,4.0,,,2042.0,,9100.0,3000000.0,,,1.0,,Open Pit,"Autoclaving, Heap Leach, High Pressure Acid Leach, Solvent-Extraction Electrowinning","Briquettes, Powder",,,633000.0,1995-02-06,,,Initial Capital Cost,"In early May 1999, the A$1 billion phase-one operation began production. (Anaconda Nickel PR 5/7/99)_x000D_
	Based on a 1996 study by Fluor Daniel, capital costs were estimated at A$900 million, the same as in BHP's earlier study, for production of 44,210 mt/y Ni and 3,110 mt/y Co over the first five years.  (MJ 2/21/97)_x000D_
	In August 1997, Glencore paid Anaconda $60 million and committed to provide A$160 million towards the A$900 million capital costs. _x000D_
  	In July 1997, Anaconda announced the completion of financing, including a $409 million U.S. Capital Markets Issue led by NatWest Capital. The project was on track for commissioning in the third quarter of 1998.  (MW 7/21/97)_x000D_
	Following a reserve upgrade in early 1996, the project was upgraded accordingly to process 3.75 million mt/y of ore and costs increased to A$770 million.  (WAUS 5/6/96)_x000D_
   In July 1996, a Barclay Mowlen-led consortium agreed to provide A$290 million for infrastructure.  (Canberra Times 7/10/96)_x000D_
	In February 1995, capital costs were estimated at A$400.  (MB 2/6/95)  The costs were relatively low because of the proximity to existing infrastructure.  (MB 8/31/95)",1995.0,Glencore plc,Glencore PLC,Glencore,,100.0,100.0,Baar,"Baar, Zug",Baar [CH],Zug,Switzerland,Europe,Murrin Murrin,"Abednego, Anaconda, Central Bore, Irwin Hills, M39/426, M39/456, M39/552, M39/553, M39/569, Murrin Murrin South",Australia,Active,Operating,2019.0,1456420.0,1.03,45750.0,237.0,2353000.0,141400000.0,Alpha Fine Chemicals website (May 2020)Glencore AnnRpt 2019,8802428.308606435,3925666.3714132425,9066501.157864628,0.005046047996179288,31.83431693989071,4.0,0.0040960000000000015,Operating-stage
829,27630.0,27630.0,Musongati,Nickel,3.0,03/2009,Open Pit,,,"Nickel,Cobalt,Copper,Platinum",Rutana,Africa,-3.74421,30.24679,Exact,35 km NE of Rutana,,,,2.0,2.0,2.0,1.0,,,,,,,,,,,3.0,MidUral Group (Owner) 63.77%; Republic of Burundi (Owner) 15%; RusChrome GmbH (Owner) 14.05%,,,,,,,,,,,,,,,,,,,,,,,,,,,,,Open Pit,"Pressure Acid Leaching, Solvent-Extraction Electrowinning",,,,700000.0,1993-04-09,,,Initial Capital Cost,"A 1999 report stated that it would cost $700 million to develop the deposit. (PD 3/99)_x000D_
   BURUNDI MINING ESTIMATED IN A 1990 PREFEASIBILITY REPORT THAT A PROJECT TO PRODUCE 30,000 mt/y Ni WOULD BE POSSIBLE AT A COST OF $490 MILLION.  (MJ 4/9/93)",1993.0,MidUral Group,MidUral Group,MidUral Group,,63.77,100.0,,,,,Russia,Europe,Musongati,"Buhinda, Burundi, Geyuka, Nyabikere, Rubara, Waga",Burundi,Active,Feasibility,2009.0,,0.96,,184.7,2419570.0,,Argosy Mining Corp PR19990211,,,,,,7.0,0.11764899999999996,Feasibility-stage
849,31894.0,31894.0,New Morning,Nickel,7.0,07/2003,Underground,,,Nickel,Western Australia,Asia-Pacific,-32.45306,119.68,Exact,140 km SSE of Southern Cross; 360 km E of Perth,,,,1.0,1.0,1.0,1.0,,,,,,,,,,,2.0,"2176423 Ontario Ltd. (Owner) 24.72%; Royce & Associates, LP (Owner) 5.08%",,,,,,,,,,,,,,,,,,,,,,,300.0,99000.0,,,,,Underground,,,,,21400.0,2001-03-19,,,Initial Capital Cost,Capital costs were estimated at A$37 million in a March 2001 scoing study. (NM 3/19/01),2001.0,2176423 Ontario Ltd.,2176423 Ontario Ltd.,2176423 Ontario,,24.72,82.95,Toronto,"Toronto, Ontario",Toronto [CA],Ontario,Canada,United States and Canada,New Morning,,Australia,Inactive,Reserves Development,2003.0,,1.41,,6.23,87928.0,,,,,,,,4.0,0.0040960000000000015,Development-stage
864,27077.0,27077.0,Nickel West,Nickel,10.0,10/2019,Open Pit,Underground,,"Nickel,Cobalt",Western Australia,Asia-Pacific,-27.23056,120.545,Exact,80 km N of Leinster,,,,1.0,1.0,1.0,1.0,,,,,,,,,,,1.0,BHP Group (Owner) 100%,2.0,Franco-Nevada Corporation (GR); Franco-Nevada Corporation (NPI),,,,,,,,,,,,,1979.0,,1995.0,1.0,,,2035.0,,34850.0,11500000.0,,,,2.8,"Block & Panel Caving, Open Pit, Sublevel Stoping, Underground","Flotation, Grinding","Concentrate, Matte",,,310500.0,,,1995-01-01,Initial Capital Cost,"The mine was commissioned in October 1995 at a cost of A$450 million.  (MM 7/95)_x000D_
   ESTIMATED COSTS INCLUDEd DEVELOPMENT OF MINE INFRASTRUCTURE, A 6.6 MILLION-MT/Y CONCENTRATOR, PORT STORAGE FACILITIES, AND PORT LOADING FACILITIES.  (MG 10/90) _x000D_
   ACM AND OUTOKUMPU SECURED A $400-MILLION LIMITED RECOURSE FUNDING FACILITY IN JUNE 1990.  BARCLAYS BANK, DEUTSCHE BANK, AND UNION BANK OF SWITZERLAND AGREED TO ACT AS JOINT ARRANGERS AND UNDERWRITERS OF THE PACKAGE.  (MB 7/2/90) _x000D_
   ACM PLANNED TO MEET ITS SHARE OF THE PROJECT BY ARRANGING FUNDING OF $193 MILLION OF WHICH 30% was to BE EQUITY AND 70% DEBT.  IN ADDITION, A $60 MILLION STANDBY FINANCING WAS TO BE ARRANGED TO COVER ACM'S SHARE OF POSSIBLE CAPITAL COST OVERRUNS.  OUTOKUMPU WAS TO PAY $12.5 MILLION TO ACM ON COMPLETION OF THE LONG-TERM FINANCING TO EARN ITS 50% SHARE.  (MJ 11/23/90) _x000D_
   A PROPOSAL BY OUTOKUMPU TO PROVIDE 100% OF THE DEVELOPMENT COSTS, EXPECTED TO REACH ABOUT $450 MILLION OVER THE NEXT SEVERAL YEARS, WAS REJECTED BY THE AUSTRALIAN TREASURAY BECAUSE IT FAILED TO MEET GUIDELINES OF THE FOREIGN ACQUISITIONS AND TAKEOVERS ACT.  (AMM 9/9/91)",1995.0,BHP Group,BHP Group,BHP Grp,,100.0,100.0,Melbourne,"Melbourne, Victoria",Melbourne [AU],Victoria,Australia,Asia-Pacific,Nickel West,"Cliffs, Kalgoorlie Smelter, Kambalda Concentrator, Kwinana Refinery, Leinster, MKD.5, Mount Keith, Mt Keith, Perseverance, Rocky's Reward",Australia,Active,Operating,2019.0,670160.0,0.63,75000.0,87226.0,,3128760.0,106250000AustralianMines PR 20200403,452174.08474374894,284166.90913278254,284869.6733885618,0.2632782883058953,8.935466666666667,4.0,0.0040960000000000015,Operating-stage
883,29592.0,29592.0,Niwest,Nickel,4.0,04/2020,Open Pit,,,"Nickel,Cobalt",Western Australia,Asia-Pacific,-28.67722,121.71611,Exact,670 km NE of Perth,The Niwest project is located near Murrin Murrin in the northeastern goldfields of Western Australia. (GME Resources WS 2/11),,,1.0,1.0,1.0,1.0,,,,,,,,,,,2.0,GME Resources Limited (Owner) 100%; Private Interest (Fractional),5.0,Franco-Nevada Corporation (Royalty); Glencore AG (Royalty); Private Interest (Royalty); Retford Resources NL (Royalty),,,,,,,,,,,,,,,2010.0,,,,2030.0,,7300.0,2400000.0,,,2.1,,Open Pit,"Agglomeration, Crushing, Crystallization, Heap Leach, Solvent Extraction","Carbonate, Sulfates",,,712768.311573357,2007-05-14,,,Initial Capital Cost,"In August 2018, the NiWest PFS highlighted an open pit/heap leach operation at a nameplate capacity of 2.4 million mt/y with average annual production of 19,200 mt nickel and 1,400 mt cobalt over the first 15 years. Forecast pre-production capital expenditure was A$966.3 million, including a contingency of A$120.2 million.   (GME Expl. Rpt Aug 2, 2018)_x000D_
	In December 2013, GME announced the results of a scoping study for a combined heap leach - SXEW operation at the NiWest project. The study outlined a 1.5 million-mt/y operation producing 14,000 mt/y of nickel cathode and 540 mt/y of cobalt over at least 20 years. Initial capital costs were projected at $420 million (A$460 million), including a contingency of $94 million (A$103 million). (GME PR 12/11/13)_x000D_
	As of October 2012, GME envisioned a 3.5 million mt/y heap leach project with a 20 year mine life. Metal production was estimated at 30,000 mt/y Ni grading 1%. The captial cost was estimated at $600 million. (GME PR 10/19/12)			_x000D_
	In November 2009, GME's website stated that the feasibility study (which was on hold) was for an expanded $1 billion (A$1.1 billion) heap leach project, which would process 3.5 - 4.5 million mt/y of ore (GME WS 11/09), and produce 30,000-35,000 mt/y Ni over a mine life of 20 years. (GME PR 6/10/08)_x000D_
	In May 2007, a completed prefeasibility study estimated total capital costs for the NiWest heap leach project at A$455.5 million ($378 million). (GME PR 5/14/07)",2007.0,GME Resources Limited,GME Resources Ltd.,GME Rsrc Ltd,,100.0,100.0,West Perth,"West Perth, Western Australia",West Perth [AU],Western Australia,Australia,Asia-Pacific,Niwest,"Camelback, Duck Hill, E39/1784, E39/1794, E39/1831, Eucalyptus, Hepi, M37/1216, M37/591, M39/460, M39/717, M39/718, M39/819, M39/878, M39/879, Macey Hill, Mertondale, Mount KilKenny, Mt Kilkenny, Murrin Murrin, Murrin Murrin Hepi, Murrin Murrin North, Murrin North, P37/8427, P37/8428, P39/6032, PL39/5962, Waite Kauri, Wanbanna",Australia,Active,Operating,2020.0,590590.0,0.91,22600.0,85.2,878000.0,64900000.0,Western Areas Resource Statement 2019; Western Areas PR20181022GME Resources Ltd PR20180802,4687848.857809016,2242450.763437566,4265942.460606204,0.005297774221921518,26.132300884955754,4.0,0.0040960000000000015,Operating-stage
891,27118.0,27118.0,Nonoc,Nickel,12.0,12/2012,Open Pit,,,"Nickel,Cobalt,Iron Ore",Surigao del Norte,Asia-Pacific,9.83278,125.61056,Exact,12 km SSW of Cagdianao; 13.5 km NE of Surigao City,,,,2.0,2.0,2.0,2.0,,,,,,,,,,,1.0,Philnico Mining and Industrial Corp. (Owner) 100%,,,,,,,,,,,,,,,1975.0,,2010.0,,1986.0,,,,10600.0,3500000.0,,,,,Open Pit,"Pressure Acid Leaching, Solvent-Extraction Electrowinning",Concentrate,,,1000000.0,2000-04-04,,,Initial Capital Cost,"By June 2005, Jinchuan and Baosteel had agreed to jointly invest $1.0 billion to resume production at the Nonoc nickel ore-dressing plant. The nickel ore-dressing plant was expected to restart production in 2008 and yield 86,000 mt/y of Cu concentrates, and equivalent to 41,000 mt/y Ni metal. (Copper & Nickel Monthly 6/1/05)_x000D_
	In July 2001, Philnico was negotiating to raise $1 billion to reopen Nonoc. The company was intending to raise half of the needed capital through investors, and the other half through bank loans. Implats reportedly said that it would invest up to 25% of the funds needed. (ME 7/01)_x000D_
	In December 2000, a feasibility study estimated capital costs for the project at $1.1 billion, 55% of which would be funded through equity, and 45% by banks._x000D_
	Philnico had planned to install three pressure acid leach autoclaves to produce 41,500 mt/y of nickel sulfides, and 4,000 mt of cobalt sulfides. (MB 12/4/00)",2000.0,Philnico Mining and Industrial Corp.,Philnico Mining Industrial,Philnico Mining,,100.0,100.0,Makati City,"Makati City, Metro Manila",Makati City [PH],Metro Manila,Philippines,Asia-Pacific,Nonoc,"Philnico, Suriago",Philippines,Active,Feasibility,2012.0,,1.32,,314.516939,2987911.0,,"MGB, 2018",,,,,,8.0,0.2621440000000001,Feasibility-stage
895,35378.0,35378.0,North Kambalda,Nickel,10.0,10/2021,Underground,,,"Nickel,Cobalt,Copper,Gold,Platinum,Palladium,Silver",Western Australia,Asia-Pacific,-31.17766,121.69289,Exact,5 km ENE of Kambalda West,,,,1.0,1.0,1.0,1.0,,,,,,,,,,,1.0,Mincor Resources NL (Owner) 100%,1.0,Metals X Limited (Royalty) 1.35%,,,,,,,,,,,,,1970.0,,,,,,,,,,,,,,Underground,Flotation,Concentrate,,,15051.0394158408,2016-03-10,,,Initial Capital Cost,"In March 2016, the initial capital cost was estimated at A$20.2 million for Durkin North. (Mincor PR Mar 10, 2016)",2016.0,Mincor Resources NL,Mincor Resources NL,Mincor Rsrc NL,,100.0,100.0,West Perth,"West Perth, Western Australia",West Perth [AU],Western Australia,Australia,Asia-Pacific,North Kambalda,"Apex, Boundary East, Carnilya Hill, Coronet, Durkin, Durkin Deeps, Durkin North, Durkin Oxide, Gellatly, Golden Mile, Juan East, KD7329, KD7615, Ken, Location 48, Lone Star, Long, Long-Victor, McMahon, Merry Hampton East, Merry Hamptons, Otter Juan, USNOB Trend",Australia,Active,Operating,2021.0,16200.0,2.4,501.0,,,675000.0,,635670.1963546705,458612.45820816996,1100669.8996996079,0.0004551773425772175,32.33532934131737,4.0,0.0040960000000000015,Operating-stage
